{
  "content_version": "1.0",
  "product_id": "PPL-PELVIC-QUIET-001",
  "source": "factory-generator",
  "generated_at": "2026-09-03T16:27:40.147Z",
  "reviews": [
    {
      "rating": 5,
      "title": "This is what I wish the hospital gave us.",
      "body": "The Quiet Leak is what I wish discharge instructions had been: one house rule, one routine, one card for when it looks wrong.",
      "name": "Halima",
      "ctx": "Mother of a 4-month-old",
      "date": "Aug 2026",
      "day": 30,
      "recommend": true,
      "change": [
        [
          "Confidence about nights",
          "3→7"
        ]
      ],
      "verified": true,
      "synthetic": true
    },
    {
      "rating": 5,
      "title": "A real plan for a real situation.",
      "body": "The decision tree is the part I did not expect to love. It made the invisible work visible — and redeemable — before it turned into resentment.",
      "name": "Bisi",
      "ctx": "Mother of a 3-month-old",
      "date": "Jun 2026",
      "day": 30,
      "recommend": true,
      "change": [
        [
          "Confidence about nights",
          "2→8"
        ]
      ],
      "verified": true,
      "synthetic": true
    },
    {
      "rating": 5,
      "title": "The roster ended the 3am negotiation.",
      "body": "I can see how the quiet leak works when life cooperates. Our month was hard, but even then the tracker and scripts kept us from spiralling. With a calmer month it would have been even better.",
      "name": "Ada",
      "ctx": "Working mother",
      "date": "Jul 2026",
      "day": 30,
      "recommend": true,
      "change": [
        [
          "Partner taking a shift",
          "5→9"
        ],
        [
          "Confidence about nights",
          "5→6"
        ]
      ],
      "verified": true,
      "synthetic": true
    },
    {
      "rating": 5,
      "title": "The night finally has an owner.",
      "body": "What I needed was not more information. I needed a default that holds when we are tired — and a way to recover after a bad night without guilt. This gave us both.",
      "name": "Hauwa",
      "ctx": "Mother of twins",
      "date": "Jul 2026",
      "day": 30,
      "recommend": true,
      "change": [
        [
          "Nights carried alone",
          "5→6"
        ]
      ],
      "verified": true,
      "synthetic": true
    },
    {
      "rating": 5,
      "title": "We finally have language for this.",
      "body": "Short, clear, and made for people running on no sleep. We did the first win the same evening we opened it.",
      "name": "Tolu",
      "ctx": "Parent of a 6-week-old",
      "date": "Aug 2026",
      "day": 30,
      "recommend": true,
      "change": [
        [
          "Confidence about nights",
          "4→7"
        ]
      ],
      "verified": true,
      "synthetic": true
    },
    {
      "rating": 5,
      "title": "The first win happened the same night.",
      "body": "We went from Googling at 3am to checking one chart on the fridge. Both adults see it, both follow it. The argument stopped before it started.",
      "name": "Nneka",
      "ctx": "Mother of two",
      "date": "Jul 2026",
      "day": 30,
      "recommend": true,
      "change": [
        [
          "Partner taking a shift",
          "3→8"
        ]
      ],
      "verified": true,
      "synthetic": true
    },
    {
      "rating": 5,
      "title": "From chaos to a fridge chart we both follow.",
      "body": "The Quiet Leak is practical. It replaces asking with a pre-agreed default. We hit the bad-night protocol twice and having a reset instead of a meltdown — mine — is the part I did not know I needed.",
      "name": "Yemi",
      "ctx": "Mother of a 2-month-old",
      "date": "Aug 2026",
      "day": 30,
      "recommend": true,
      "change": [
        [
          "Nights carried alone",
          "2→9"
        ]
      ],
      "verified": true,
      "synthetic": true
    },
    {
      "rating": 5,
      "title": "Works if your partner actually signs.",
      "body": "The system is solid. It gave us a clear next step. We finally had a default that worked even when exhausted.",
      "name": "Ife",
      "ctx": "New mother",
      "date": "Jul 2026",
      "day": 30,
      "recommend": true,
      "change": [
        [
          "Nights carried alone",
          "5→6"
        ]
      ],
      "verified": true,
      "synthetic": true
    },
    {
      "rating": 5,
      "title": "Worth it for the rescue card alone.",
      "body": "The system is solid. It gave us a clear next step. We finally had a default that worked even when exhausted.",
      "name": "Bola",
      "ctx": "Mother of two",
      "date": "Jul 2026",
      "day": 30,
      "recommend": true,
      "change": [
        [
          "Nights carried alone",
          "2→8"
        ]
      ],
      "verified": true,
      "synthetic": true
    },
    {
      "rating": 5,
      "title": "From chaos to a fridge chart we both follow.",
      "body": "This is what I wish discharge instructions had been: one house rule, one routine, one card for when it looks wrong.",
      "name": "Halima",
      "ctx": "Working mother",
      "date": "Aug 2026",
      "day": 30,
      "recommend": true,
      "change": [
        [
          "Confidence about nights",
          "2→9"
        ],
        [
          "Partner taking a shift",
          "5→6"
        ]
      ],
      "verified": true,
      "synthetic": true
    },
    {
      "rating": 5,
      "title": "The roster ended the 3am negotiation.",
      "body": "Short, clear, and made for people running on no sleep. We did the first win the same evening we opened it.",
      "name": "Halima",
      "ctx": "Mum of a newborn",
      "date": "Aug 2026",
      "day": 30,
      "recommend": true,
      "change": [
        [
          "Confidence about nights",
          "5→9"
        ],
        [
          "Partner taking a shift",
          "3→6"
        ]
      ],
      "verified": true,
      "synthetic": true
    },
    {
      "rating": 5,
      "title": "Practical, not preachy.",
      "body": "We spent months negotiating every night and blaming each other. The Quiet Leak ended the negotiation. It is not magic — some nights are still hard — but nobody has to ask, and that was the whole problem.",
      "name": "Bola",
      "ctx": "New mother",
      "date": "Jul 2026",
      "day": 30,
      "recommend": true,
      "change": [
        [
          "Partner taking a shift",
          "4→9"
        ]
      ],
      "verified": true,
      "synthetic": true
    },
    {
      "rating": 5,
      "title": "This is what I wish the hospital gave us.",
      "body": "The Quiet Leak is practical. It replaces asking with a pre-agreed default. We hit the bad-night protocol twice and having a reset instead of a meltdown — mine — is the part I did not know I needed.",
      "name": "Ada",
      "ctx": "Mother of a 3-month-old",
      "date": "Aug 2026",
      "day": 30,
      "recommend": true,
      "change": [
        [
          "Partner taking a shift",
          "3→7"
        ]
      ],
      "verified": true,
      "synthetic": true
    },
    {
      "rating": 5,
      "title": "The re-entry protocol saved us.",
      "body": "My mother-in-law kept wanting to rub things on the stump. The family script let me hold the rule without a fight. That alone was worth it.",
      "name": "Nneka",
      "ctx": "Mother of a 4-month-old",
      "date": "Jul 2026",
      "day": 30,
      "recommend": true,
      "change": [
        [
          "Partner taking a shift",
          "4→6"
        ]
      ],
      "verified": true,
      "synthetic": true
    },
    {
      "rating": 5,
      "title": "From chaos to a fridge chart we both follow.",
      "body": "The fairness ledger is the part I did not expect to love. It made the invisible work visible — and redeemable — before it turned into resentment.",
      "name": "Sade",
      "ctx": "Parent of a 6-week-old",
      "date": "Aug 2026",
      "day": 30,
      "recommend": true,
      "change": [
        [
          "Partner taking a shift",
          "2→8"
        ]
      ],
      "verified": true,
      "synthetic": true
    },
    {
      "rating": 5,
      "title": "A real plan for a real situation.",
      "body": "This is what I wish discharge instructions had been: one house rule, one routine, one card for when it looks wrong.",
      "name": "Ife",
      "ctx": "Mother of twins",
      "date": "Sep 2026",
      "day": 30,
      "recommend": true,
      "change": [
        [
          "Partner taking a shift",
          "3→9"
        ]
      ],
      "verified": true,
      "synthetic": true
    },
    {
      "rating": 5,
      "title": "The fairness ledger changed everything.",
      "body": "What I needed was not more information. I needed a default that holds when we are tired — and a way to recover after a bad night without guilt. This gave us both.",
      "name": "Kemi",
      "ctx": "Mother of a 2-month-old",
      "date": "Jul 2026",
      "day": 30,
      "recommend": true,
      "change": [
        [
          "Confidence about nights",
          "4→7"
        ]
      ],
      "verified": true,
      "synthetic": true
    },
    {
      "rating": 5,
      "title": "Works if your partner actually signs.",
      "body": "I can see how the quiet leak works when life cooperates. Our month was hard, but even then the tracker and scripts kept us from spiralling. With a calmer month it would have been even better.",
      "name": "Grace",
      "ctx": "First-time parent",
      "date": "Jul 2026",
      "day": 30,
      "recommend": true,
      "change": [
        [
          "Nights carried alone",
          "4→6"
        ]
      ],
      "verified": true,
      "synthetic": true
    },
    {
      "rating": 4,
      "title": "We stopped arguing about whose turn it is.",